{
  "schema_version": "1.0",
  "record_type": "daily_energy",
  "user_id": 1,
  "source_type": "uploaded",
  "data": {
    "date": "2026-08-20",
    "source": "qa",
    "total_expenditure_kcal": 2420,
    "resting_expenditure_kcal": 1810,
    "active_expenditure_kcal": 610,
    "steps": 8200,
    "distance_meters": 6400,
    "notes": "Fictional QA energy record"
  }
}

