[
  {
    "schema_version": "1.0",
    "record_type": "daily_energy",
    "user_id": 1,
    "source_type": "uploaded",
    "data": {
      "date": "2026-08-21",
      "source": "qa",
      "total_expenditure_kcal": 2350,
      "steps": 7600
    }
  },
  {
    "schema_version": "1.0",
    "record_type": "daily_energy",
    "user_id": 1,
    "source_type": "uploaded",
    "data": {
      "date": "2026-08-22",
      "source": "qa",
      "total_expenditure_kcal": 2480,
      "active_expenditure_kcal": 640
    }
  }
]

